{
  "context": {
    "task_id": "task_service_detect_hybrid",
    "run_id": "run_service_detect_hybrid",
    "operator": "operator",
    "workspace": "default",
    "authorization_scope": "fixture:local-only"
  },
  "target": {"type": "service", "value": "93.184.216.34:443", "metadata": {}},
  "inputs": {
    "services": [
      {"address": "93.184.216.34", "port": 443, "protocol": "tcp", "hostnames": ["www.example.com"]}
    ],
    "findings": []
  },
  "options": {
    "mode": "hybrid",
    "detection_depth": "passive",
    "passive_intel": {
      "enabled": true,
      "sources": ["fixture", "local_cache", "passive_service_cache"],
      "prefer_sources": ["fixture", "local_cache", "passive_service_cache"],
      "api_timeout_seconds": 10,
      "api_rate_limit_per_second": 1,
      "max_queries": 50,
      "allow_missing_secrets": true,
      "local_cache_file": "examples/fixture.services.example.com.json",
      "fixture_file": "examples/fixture.services.example.com.json",
      "passive_service_cache_file": "examples/fixture.services.example.com.json"
    },
    "active": {
      "enabled": false,
      "probe_profiles": ["tcp_banner", "tls_hello", "http_head"],
      "timeout_seconds": 3,
      "concurrency": 5,
      "rate_limit_per_second": 5,
      "max_services": 50,
      "max_probes_per_service": 3,
      "max_response_bytes": 4096
    },
    "merge": {
      "deduplicate": true,
      "conflict_policy": "preserve_all_sources",
      "mark_source_disagreement": true,
      "confidence_strategy": "weighted_sources",
      "stale_after_days": 30
    },
    "output": {
      "include_unknown": true,
      "include_source_details": true,
      "include_conflicts": true,
      "mask_sensitive_headers": true,
      "truncate_banner_bytes": 512
    },
    "risk_acknowledged": false,
    "execution_profile": "passive_intel"
  },
  "policy": {"allow_active_verify": false, "allow_high_risk": false}
}
